{
  "schemaVersion": "openacp-child-ledger.v1",
  "artifactType": "child-ledger",
  "ledgerId": "LEDGER-<lane>-001",
  "laneId": "<lane-id>",
  "children": [
    {
      "promptId": "<child-prompt-id>",
      "taskId": "<task-id>",
      "role": "worker",
      "authority": "B2",
      "effects": ["<allowed-effect>"],
      "subagentIdOrToolStatus": "direct-subagent | unavailable | fallback-launcher",
      "expectedHandoffPath": ".openacp/handoffs/<handoff-id>.json",
      "dispatchStatus": "not_started",
      "handoffStatus": "expected",
      "consumeStatus": "not_consumed",
      "remainingRisk": "Not dispatched yet."
    }
  ]
}
